{
  "schemaVersion": 1,
  "status": "PASS",
  "ciRunId": "29189796523",
  "artifactName": "RCP-macos-net7.0-src-2337839-test-bf9c523",
  "artifactSha256": "aaaaaaaaaaaaaaaaaaaaaaaaaaaaaaaaaaaaaaaaaaaaaaaaaaaaaaaaaaaaaaaa",
  "sourceCommit": "23378395be4d993cb36886730de63b6dea1b3f22",
  "testedCommit": "bf9c523bf9c523bf9c523bf9c523bf9c523bf9c",
  "platform": "macos",
  "framework": "net7.0",
  "architecture": "arm64",
  "pluginVersion": "0.2.1",
  "rhinoVersion": "8.30.26103.11002",
  "panelId": "7b3e4f2a-1d8c-4e5f-9a6b-3c2d1e0f8a7b",
  "panelRegistered": true,
  "panelOpened": true,
  "panelVisible": true,
  "panelInstanceType": "RhinoCommercialPlatform.Plugin.Panels.RhinoMainPanelHost",
  "settingsSave": true,
  "settingsReload": true,
  "logDirectoryExists": true,
  "testedAtUtc": "2026-07-13T00:00:00Z",
  "failures": []
}
